 1 0.000000000 HewlettP_2d:df:4c → Broadcast    ARP 60 Who has 10.255.214.1? Tell 10.255.255.253
    2 0.058276676   10.205.6.1 → 10.255.150.111 UDP 214 5068 → 19092 Len=172
    3 0.069216044   10.205.6.1 → 10.255.150.111 UDP 214 5068 → 19092 Len=172
    4 0.073099222   10.205.6.1 → 10.255.150.111 SIP/SDP 742 Status: 200 OK | 
    5 0.073826024 10.255.150.111 → 10.205.6.1   SIP 465 Request: ACK sip:61@10.205.6.1:5060 | 
    6 0.074799964 10.255.150.111 → 10.205.7.1   SIP/SDP 923 Status: 200 OK | 
    7 0.078201496 10.255.150.111 → 10.205.6.1   SIP/SDP 871 Request: INVITE sip:61@10.205.6.1:5060, in-dialog | 
    8 0.079078440   10.205.6.1 → 10.255.150.111 RTP 214 PT=ITU-T G.711 PCMA, SSRC=0xF2DF3695, Seq=63459, Time=320
    9 0.079880743   10.205.6.1 → 10.255.150.111 SIP 347 Status: 100 Trying | 
   10 0.080654215   10.205.7.1 → 10.255.150.111 SIP 606 Request: ACK sip:61@10.255.150.111:5060 | 
   11 0.080910573 10.255.150.111 → 10.205.7.1   SIP/SDP 868 Request: INVITE sip:62@10.205.7.1:5060, in-dialog | 
   12 0.081887347   10.205.7.1 → 10.255.150.111 SIP 371 Status: 100 Trying | 
   13 0.082684718 10.255.150.111 → 10.205.7.1   RTP 214 PT=ITU-T G.711 PCMA, SSRC=0x4E034C3, Seq=22272, Time=320, Mark
   14 0.150115325   10.205.7.1 → 10.255.150.111 SIP/SDP 766 Status: 200 OK | 
   15 0.150571021 10.255.150.111 → 10.205.7.1   SIP 460 Request: ACK sip:62@10.205.7.1:5060 | 
   16 0.155356337   10.205.6.1 → 10.255.150.111 SIP/SDP 747 Status: 200 OK | 
   17 0.155809680 10.255.150.111 → 10.205.6.1   SIP 465 Request: ACK sip:61@10.205.6.1:5060 | 
   18 0.558584491 10.255.150.111 → 10.205.7.1   SSH 206 Server: Encrypted packet (len=140)
   19 0.558872958 10.255.150.111 → 10.205.7.1   SSH 102 Server: Encrypted packet (len=36)
   20 0.559154813   10.205.7.1 → 10.255.150.111 TCP 66 37174 → 22 [ACK] Seq=1 Ack=141 Win=501 Len=0 TSval=3681648775 TSecr=28515939
   21 0.559277940   10.205.7.1 → 10.255.150.111 TCP 66 37174 → 22 [ACK] Seq=1 Ack=177 Win=501 Len=0 TSval=3681648775 TSecr=28515939
   22 0.560064973 10.255.150.111 → 10.205.7.1   SSH 182 Server: Encrypted packet (len=116)
   23 0.560253702 10.255.150.111 → 10.205.7.1   SSH 102 Server: Encrypted packet (len=36)
   24 0.560526053   10.205.7.1 → 10.255.150.111 TCP 66 37174 → 22 [ACK] Seq=1 Ack=293 Win=501 Len=0 TSval=3681648776 TSecr=28515939
   25 0.560543027   10.205.7.1 → 10.255.150.111 TCP 66 37174 → 22 [ACK] Seq=1 Ack=329 Win=501 Len=0 TSval=3681648776 TSecr=28515939
   26 0.560582064 10.255.150.111 → 10.205.7.1   SSH 182 Server: Encrypted packet (len=116)
   27 0.560715156 10.255.150.111 → 10.205.7.1   SSH 102 Server: Encrypted packet (len=36)
   28 0.560897667   10.205.7.1 → 10.255.150.111 TCP 66 37174 → 22 [ACK] Seq=1 Ack=445 Win=501 Len=0 TSval=3681648777 TSecr=28515939
   29 0.560964276   10.205.7.1 → 10.255.150.111 TCP 66 37174 → 22 [ACK] Seq=1 Ack=481 Win=501 Len=0 TSval=3681648777 TSecr=28515939
   30 0.561971517 10.255.150.111 → 10.205.7.1   SSH 182 Server: Encrypted packet (len=116)
   31 0.562111487 10.255.150.111 → 10.205.7.1   SSH 102 Server: Encrypted packet (len=36)
   32 0.562454165   10.205.7.1 → 10.255.150.111 TCP 66 37174 → 22 [ACK] Seq=1 Ack=597 Win=501 Len=0 TSval=3681648778 TSecr=28515940
   33 0.562472887   10.205.7.1 → 10.255.150.111 TCP 66 37174 → 22 [ACK] Seq=1 Ack=633 Win=501 Len=0 TSval=3681648778 TSecr=28515940
   34 0.562548398 10.255.150.111 → 10.205.7.1   SSH 198 Server: Encrypted packet (len=132)
   35 0.562677801 10.255.150.111 → 10.205.7.1   SSH 102 Server: Encrypted packet (len=36)
   36 0.562786346   10.205.7.1 → 10.255.150.111 TCP 66 37174 → 22 [ACK] Seq=1 Ack=765 Win=501 Len=0 TSval=3681648779 TSecr=28515940
   37 0.562942234   10.205.7.1 → 10.255.150.111 TCP 66 37174 → 22 [ACK] Seq=1 Ack=801 Win=501 Len=0 TSval=3681648779 TSecr=28515940
   38 0.563310002 10.255.150.111 → 10.205.7.1   SSH 182 Server: Encrypted packet (len=116)
   39 0.563449935 10.255.150.111 → 10.205.7.1   SSH 102 Server: Encrypted packet (len=36)
   40 0.563586853   10.205.7.1 → 10.255.150.111 TCP 66 37174 → 22 [ACK] Seq=1 Ack=917 Win=501 Len=0 TSval=3681648779 TSecr=28515940
   41 0.563679811   10.205.7.1 → 10.255.150.111 TCP 66 37174 → 22 [ACK] Seq=1 Ack=953 Win=501 Len=0 TSval=3681648779 TSecr=28515940
   42 0.563991666 10.255.150.111 → 10.205.7.1   SSH 214 Server: Encrypted packet (len=148)
   43 0.564119088 10.255.150.111 → 10.205.7.1   SSH 102 Server: Encrypted packet (len=36)
   44 0.564234855   10.205.7.1 → 10.255.150.111 TCP 66 37174 → 22 [ACK] Seq=1 Ack=1101 Win=501 Len=0 TSval=3681648780 TSecr=28515940
   45 0.564418254   10.205.7.1 → 10.255.150.111 TCP 66 37174 → 22 [ACK] Seq=1 Ack=1137 Win=501 Len=0 TSval=3681648780 TSecr=28515940
   46 0.564584446 10.255.150.111 → 10.205.7.1   SSH 222 Server: Encrypted packet (len=156)
   47 0.564716202 10.255.150.111 → 10.205.7.1   SSH 102 Server: Encrypted packet (len=36)
   48 0.564905741   10.205.7.1 → 10.255.150.111 TCP 66 37174 → 22 [ACK] Seq=1 Ack=1293 Win=501 Len=0 TSval=3681648781 TSecr=28515940
   49 0.565086793   10.205.7.1 → 10.255.150.111 TCP 66 37174 → 22 [ACK] Seq=1 Ack=1329 Win=501 Len=0 TSval=3681648781 TSecr=28515940
   50 0.565127508 10.255.150.111 → 10.205.7.1   SSH 182 Server: Encrypted packet (len=116)
   51 0.565267810 10.255.150.111 → 10.205.7.1   SSH 102 Server: Encrypted packet (len=36)
   52 0.565566265   10.205.7.1 → 10.255.150.111 TCP 66 37174 → 22 [ACK] Seq=1 Ack=1481 Win=501 Len=0 TSval=3681648781 TSecr=28515941
   53 0.565631859 10.255.150.111 → 10.205.7.1   SSH 206 Server: Encrypted packet (len=140)
   54 0.565799732 10.255.150.111 → 10.205.7.1   SSH 102 Server: Encrypted packet (len=36)
   55 0.565981830   10.205.7.1 → 10.255.150.111 TCP 66 37174 → 22 [ACK] Seq=1 Ack=1621 Win=501 Len=0 TSval=3681648782 TSecr=28515941
   56 0.566067293   10.205.7.1 → 10.255.150.111 TCP 66 37174 → 22 [ACK] Seq=1 Ack=1657 Win=501 Len=0 TSval=3681648782 TSecr=28515941
   57 0.566350722 10.255.150.111 → 10.205.7.1   SSH 214 Server: Encrypted packet (len=148)
   58 0.566517700 10.255.150.111 → 10.205.7.1   SSH 102 Server: Encrypted packet (len=36)
   59 0.566612798   10.205.7.1 → 10.255.150.111 TCP 66 37174 → 22 [ACK] Seq=1 Ack=1805 Win=501 Len=0 TSval=3681648782 TSecr=28515941
   60 0.566806411   10.205.7.1 → 10.255.150.111 TCP 66 37174 → 22 [ACK] Seq=1 Ack=1841 Win=501 Len=0 TSval=3681648783 TSecr=28515941
   61 0.566888548 10.255.150.111 → 10.205.7.1   SSH 182 Server: Encrypted packet (len=116)
   62 0.567041890 10.255.150.111 → 10.205.7.1   SSH 102 Server: Encrypted packet (len=36)
   63 0.567171379   10.205.7.1 → 10.255.150.111 TCP 66 37174 → 22 [ACK] Seq=1 Ack=1957 Win=501 Len=0 TSval=3681648783 TSecr=28515941
   64 0.567292252   10.205.7.1 → 10.255.150.111 TCP 66 37174 → 22 [ACK] Seq=1 Ack=1993 Win=501 Len=0 TSval=3681648783 TSecr=28515941
   65 0.567403436 10.255.150.111 → 10.205.7.1   SSH 222 Server: Encrypted packet (len=156)
   66 0.567558500 10.255.150.111 → 10.205.7.1   SSH 102 Server: Encrypted packet (len=36)
   67 0.567685881   10.205.7.1 → 10.255.150.111 TCP 66 37174 → 22 [ACK] Seq=1 Ack=2149 Win=501 Len=0 TSval=3681648783 TSecr=28515941
   68 0.567890678   10.205.7.1 → 10.255.150.111 TCP 66 37174 → 22 [ACK] Seq=1 Ack=2185 Win=501 Len=0 TSval=3681648784 TSecr=28515941
   69 0.568089747 10.255.150.111 → 10.205.7.1   SSH 182 Server: Encrypted packet (len=116)
   70 0.568222334 10.255.150.111 → 10.205.7.1   SSH 102 Server: Encrypted packet (len=36)
   71 0.568496286 10.255.150.111 → 10.205.7.1   SSH 198 Server: Encrypted packet (len=132)
   72 0.568632120   10.205.7.1 → 10.255.150.111 TCP 66 37174 → 22 [ACK] Seq=1 Ack=2337 Win=501 Len=0 TSval=3681648784 TSecr=28515941
   73 0.568741651 10.255.150.111 → 10.205.7.1   SSH 102 Server: Encrypted packet (len=36)
   74 0.568908475   10.205.7.1 → 10.255.150.111 TCP 66 37174 → 22 [ACK] Seq=1 Ack=2469 Win=501 Len=0 TSval=3681648785 TSecr=28515941
   75 0.569118118   10.205.7.1 → 10.255.150.111 TCP 66 37174 → 22 [ACK] Seq=1 Ack=2505 Win=501 Len=0 TSval=3681648785 TSecr=28515941
   76 0.569332476 10.255.150.111 → 10.205.7.1   SSH 182 Server: Encrypted packet (len=116)
   77 0.569465183 10.255.150.111 → 10.205.7.1   SSH 102 Server: Encrypted packet (len=36)
   78 0.569799384   10.205.7.1 → 10.255.150.111 TCP 66 37174 → 22 [ACK] Seq=1 Ack=2621 Win=501 Len=0 TSval=3681648785 TSecr=28515942
   79 0.569821391   10.205.7.1 → 10.255.150.111 TCP 66 37174 → 22 [ACK] Seq=1 Ack=2657 Win=501 Len=0 TSval=3681648786 TSecr=28515942
   80 0.569930188 10.255.150.111 → 10.205.7.1   SSH 198 Server: Encrypted packet (len=132)
   81 0.570075463 10.255.150.111 → 10.205.7.1   SSH 102 Server: Encrypted packet (len=36)
   82 0.570271956   10.205.7.1 → 10.255.150.111 TCP 66 37174 → 22 [ACK] Seq=1 Ack=2789 Win=501 Len=0 TSval=3681648786 TSecr=28515942
   83 0.570289092   10.205.7.1 → 10.255.150.111 SSH 102 Client: Encrypted packet (len=36)
   84 0.611940534   10.205.7.1 → 10.255.150.111 TCP 66 37174 → 22 [ACK] Seq=37 Ack=2825 Win=501 Len=0 TSval=3681648827 TSecr=28515942
   85 0.613147647 10.255.150.111 → 10.205.7.1   TCP 66 22 → 37174 [ACK] Seq=2825 Ack=37 Win=292 Len=0 TSval=28515953 TSecr=3681648786
   86 1.068538244 10.255.150.111 → 10.205.7.1   SSH 198 Server: Encrypted packet (len=132)
   87 1.068705275 10.255.150.111 → 10.205.7.1   SSH 102 Server: Encrypted packet (len=36)
   88 1.068884670   10.205.7.1 → 10.255.150.111 TCP 66 37174 → 22 [ACK] Seq=37 Ack=2957 Win=501 Len=0 TSval=3681649285 TSecr=28516066
   89 1.069058314   10.205.7.1 → 10.255.150.111 TCP 66 37174 → 22 [ACK] Seq=37 Ack=2993 Win=501 Len=0 TSval=3681649285 TSecr=28516066
   90 1.069142366 10.255.150.111 → 10.205.7.1   SSH 198 Server: Encrypted packet (len=132)
   91 1.069277547 10.255.150.111 → 10.205.7.1   SSH 102 Server: Encrypted packet (len=36)
   92 1.069569492   10.205.7.1 → 10.255.150.111 TCP 66 37174 → 22 [ACK] Seq=37 Ack=3125 Win=501 Len=0 TSval=3681649285 TSecr=28516067
   93 1.069592221   10.205.7.1 → 10.255.150.111 TCP 66 37174 → 22 [ACK] Seq=37 Ack=3161 Win=501 Len=0 TSval=3681649285 TSecr=28516067
   94 1.069656345 10.255.150.111 → 10.205.7.1   SSH 238 Server: Encrypted packet (len=172)
   95 1.069919320 10.255.150.111 → 10.205.7.1   SSH 102 Server: Encrypted packet (len=36)
   96 1.070026531   10.205.7.1 → 10.255.150.111 TCP 66 37174 → 22 [ACK] Seq=37 Ack=3333 Win=501 Len=0 TSval=3681649286 TSecr=28516067
   97 1.070170874   10.205.7.1 → 10.255.150.111 TCP 66 37174 → 22 [ACK] Seq=37 Ack=3369 Win=501 Len=0 TSval=3681649286 TSecr=28516067
   98 1.070295344 10.255.150.111 → 10.205.7.1   SSH 238 Server: Encrypted packet (len=172)
   99 1.070426310 10.255.150.111 → 10.205.7.1   SSH 102 Server: Encrypted packet (len=36)
  100 1.070537874   10.205.7.1 → 10.255.150.111 TCP 66 37174 → 22 [ACK] Seq=37 Ack=3541 Win=501 Len=0 TSval=3681649286 TSecr=28516067
  101 1.070756807   10.205.7.1 → 10.255.150.111 TCP 66 37174 → 22 [ACK] Seq=37 Ack=3577 Win=501 Len=0 TSval=3681649286 TSecr=28516067
  102 1.070839101 10.255.150.111 → 10.205.7.1   SSH 198 Server: Encrypted packet (len=132)
  103 1.071056497 10.255.150.111 → 10.205.7.1   SSH 102 Server: Encrypted packet (len=36)
  104 1.071115064   10.205.7.1 → 10.255.150.111 TCP 66 37174 → 22 [ACK] Seq=37 Ack=3709 Win=501 Len=0 TSval=3681649287 TSecr=28516067
  105 1.071387268   10.205.7.1 → 10.255.150.111 TCP 66 37174 → 22 [ACK] Seq=37 Ack=3745 Win=501 Len=0 TSval=3681649287 TSecr=28516067
  106 1.071443742 10.255.150.111 → 10.205.7.1   SSH 198 Server: Encrypted packet (len=132)
  107 1.071575487 10.255.150.111 → 10.205.7.1   SSH 102 Server: Encrypted packet (len=36)
  108 1.071787454   10.205.7.1 → 10.255.150.111 TCP 66 37174 → 22 [ACK] Seq=37 Ack=3877 Win=501 Len=0 TSval=3681649288 TSecr=28516067
  109 1.071809183   10.205.7.1 → 10.255.150.111 TCP 66 37174 → 22 [ACK] Seq=37 Ack=3913 Win=501 Len=0 TSval=3681649288 TSecr=28516067
  110 1.071921999 10.255.150.111 → 10.205.7.1   SSH 238 Server: Encrypted packet (len=172)
  111 1.072051270 10.255.150.111 → 10.205.7.1   SSH 102 Server: Encrypted packet (len=36)
  112 1.072222719   10.205.7.1 → 10.255.150.111 TCP 66 37174 → 22 [ACK] Seq=37 Ack=4085 Win=501 Len=0 TSval=3681649288 TSecr=28516067
  113 1.072289673   10.205.7.1 → 10.255.150.111 TCP 66 37174 → 22 [ACK] Seq=37 Ack=4121 Win=501 Len=0 TSval=3681649288 TSecr=28516067
  114 1.072456158 10.255.150.111 → 10.205.7.1   SSH 238 Server: Encrypted packet (len=172)
  115 1.072584204 10.255.150.111 → 10.205.7.1   SSH 102 Server: Encrypted packet (len=36)
  116 1.072851896   10.205.7.1 → 10.255.150.111 TCP 66 37174 → 22 [ACK] Seq=37 Ack=4293 Win=501 Len=0 TSval=3681649289 TSecr=28516067
  117 1.072893212   10.205.7.1 → 10.255.150.111 TCP 66 37174 → 22 [ACK] Seq=37 Ack=4329 Win=501 Len=0 TSval=3681649289 TSecr=28516067
  118 1.072938122 10.255.150.111 → 10.205.7.1   SSH 198 Server: Encrypted packet (len=132)
  119 1.073454827   10.205.7.1 → 10.255.150.111 TCP 66 37174 → 22 [ACK] Seq=37 Ack=4461 Win=501 Len=0 TSval=3681649289 TSecr=28516067
  120 1.073593850 10.255.150.111 → 10.205.7.1   SSH 102 Server: Encrypted packet (len=36)
  121 1.073905881   10.205.7.1 → 10.255.150.111 TCP 66 37174 → 22 [ACK] Seq=37 Ack=4497 Win=501 Len=0 TSval=3681649290 TSecr=28516068
  122 1.074004566 10.255.150.111 → 10.205.7.1   SSH 198 Server: Encrypted packet (len=132)
  123 1.074144089 10.255.150.111 → 10.205.7.1   SSH 102 Server: Encrypted packet (len=36)
  124 1.074362988   10.205.7.1 → 10.255.150.111 TCP 66 37174 → 22 [ACK] Seq=37 Ack=4629 Win=501 Len=0 TSval=3681649290 TSecr=28516068
  125 1.074413112   10.205.7.1 → 10.255.150.111 TCP 66 37174 → 22 [ACK] Seq=37 Ack=4665 Win=501 Len=0 TSval=3681649290 TSecr=28516068
  126 1.074518621 10.255.150.111 → 10.205.7.1   SSH 238 Server: Encrypted packet (len=172)
  127 1.074649373 10.255.150.111 → 10.205.7.1   SSH 102 Server: Encrypted packet (len=36)
  128 1.074883599   10.205.7.1 → 10.255.150.111 TCP 66 37174 → 22 [ACK] Seq=37 Ack=4837 Win=501 Len=0 TSval=3681649291 TSecr=28516068
  129 1.074918325   10.205.7.1 → 10.255.150.111 TCP 66 37174 → 22 [ACK] Seq=37 Ack=4873 Win=501 Len=0 TSval=3681649291 TSecr=28516068
  130 1.074983644 10.255.150.111 → 10.205.7.1   SSH 238 Server: Encrypted packet (len=172)
  131 1.075144655 10.255.150.111 → 10.205.7.1   SSH 102 Server: Encrypted packet (len=36)
  132 1.075245506   10.205.7.1 → 10.255.150.111 TCP 66 37174 → 22 [ACK] Seq=37 Ack=5045 Win=501 Len=0 TSval=3681649291 TSecr=28516068
  133 1.075432446   10.205.7.1 → 10.255.150.111 TCP 66 37174 → 22 [ACK] Seq=37 Ack=5081 Win=501 Len=0 TSval=3681649291 TSecr=28516068
  134 1.075550571 10.255.150.111 → 10.205.7.1   SSH 198 Server: Encrypted packet (len=132)
  135 1.075677432 10.255.150.111 → 10.205.7.1   SSH 102 Server: Encrypted packet (len=36)
  136 1.075823993   10.205.7.1 → 10.255.150.111 TCP 66 37174 → 22 [ACK] Seq=37 Ack=5213 Win=501 Len=0 TSval=3681649292 TSecr=28516068
  137 1.075898421   10.205.7.1 → 10.255.150.111 TCP 66 37174 → 22 [ACK] Seq=37 Ack=5249 Win=501 Len=0 TSval=3681649292 TSecr=28516068
  138 1.076047245 10.255.150.111 → 10.205.7.1   SSH 198 Server: Encrypted packet (len=132)
  139 1.076211922 10.255.150.111 → 10.205.7.1   SSH 102 Server: Encrypted packet (len=36)
  140 1.076363148   10.205.7.1 → 10.255.150.111 TCP 66 37174 → 22 [ACK] Seq=37 Ack=5381 Win=501 Len=0 TSval=3681649292 TSecr=28516068
  141 1.076510905   10.205.7.1 → 10.255.150.111 TCP 66 37174 → 22 [ACK] Seq=37 Ack=5417 Win=501 Len=0 TSval=3681649292 TSecr=28516068
  142 1.076621928 10.255.150.111 → 10.205.7.1   SSH 238 Server: Encrypted packet (len=172)
  143 1.076754549 10.255.150.111 → 10.205.7.1   SSH 102 Server: Encrypted packet (len=36)
  144 1.076867064   10.205.7.1 → 10.255.150.111 TCP 66 37174 → 22 [ACK] Seq=37 Ack=5589 Win=501 Len=0 TSval=3681649293 TSecr=28516068
  145 1.076978752   10.205.7.1 → 10.255.150.111 TCP 66 37174 → 22 [ACK] Seq=37 Ack=5625 Win=501 Len=0 TSval=3681649293 TSecr=28516068
  146 1.077178790 10.255.150.111 → 10.205.7.1   SSH 238 Server: Encrypted packet (len=172)
  147 1.077326941 10.255.150.111 → 10.205.7.1   SSH 102 Server: Encrypted packet (len=36)
  148 1.077411689   10.205.7.1 → 10.255.150.111 TCP 66 37174 → 22 [ACK] Seq=37 Ack=5797 Win=501 Len=0 TSval=3681649293 TSecr=28516069
  149 1.077581352   10.205.7.1 → 10.255.150.111 TCP 66 37174 → 22 [ACK] Seq=37 Ack=5833 Win=501 Len=0 TSval=3681649293 TSecr=28516069
  150 1.077804453 10.255.150.111 → 10.205.7.1   SSH 198 Server: Encrypted packet (len=132)
  151 1.077931841 10.255.150.111 → 10.205.7.1   SSH 102 Server: Encrypted packet (len=36)
  152 1.078093695   10.205.7.1 → 10.255.150.111 TCP 66 37174 → 22 [ACK] Seq=37 Ack=5965 Win=501 Len=0 TSval=3681649294 TSecr=28516069
  153 1.078138492   10.205.7.1 → 10.255.150.111 TCP 66 37174 → 22 [ACK] Seq=37 Ack=6001 Win=501 Len=0 TSval=3681649294 TSecr=28516069
  154 1.078332996 10.255.150.111 → 10.205.7.1   SSH 198 Server: Encrypted packet (len=132)
  155 1.078465189 10.255.150.111 → 10.205.7.1   SSH 102 Server: Encrypted packet (len=36)
  156 1.078576227   10.205.7.1 → 10.255.150.111 TCP 66 37174 → 22 [ACK] Seq=37 Ack=6133 Win=501 Len=0 TSval=3681649294 TSecr=28516069
  157 1.078765502   10.205.7.1 → 10.255.150.111 TCP 66 37174 → 22 [ACK] Seq=37 Ack=6169 Win=501 Len=0 TSval=3681649294 TSecr=28516069
  158 1.078878720 10.255.150.111 → 10.205.7.1   SSH 238 Server: Encrypted packet (len=172)
  159 1.079011014 10.255.150.111 → 10.205.7.1   SSH 102 Server: Encrypted packet (len=36)
  160 1.079238071   10.205.7.1 → 10.255.150.111 TCP 66 37174 → 22 [ACK] Seq=37 Ack=6341 Win=501 Len=0 TSval=3681649295 TSecr=28516069
  161 1.079258594   10.205.7.1 → 10.255.150.111 TCP 66 37174 → 22 [ACK] Seq=37 Ack=6377 Win=501 Len=0 TSval=3681649295 TSecr=28516069
  162 1.079350733 10.255.150.111 → 10.205.7.1   SSH 238 Server: Encrypted packet (len=172)
  163 1.079640362   10.205.7.1 → 10.255.150.111 TCP 66 37174 → 22 [ACK] Seq=37 Ack=6549 Win=501 Len=0 TSval=3681649295 TSecr=28516069
  164 1.079734753 10.255.150.111 → 10.205.7.1   SSH 198 Server: Encrypted packet (len=132)
  165 1.080067912   10.205.7.1 → 10.255.150.111 TCP 66 37174 → 22 [ACK] Seq=37 Ack=6681 Win=501 Len=0 TSval=3681649296 TSecr=28516069
  166 1.080168288 10.255.150.111 → 10.205.7.1   SSH 334 Server: Encrypted packet (len=268)
  167 1.080440286   10.205.7.1 → 10.255.150.111 TCP 66 37174 → 22 [ACK] Seq=37 Ack=6949 Win=501 Len=0 TSval=3681649296 TSecr=28516069
  168 1.080551752 10.255.150.111 → 10.205.7.1   SSH 238 Server: Encrypted packet (len=172)
  169 1.080829287   10.205.7.1 → 10.255.150.111 TCP 66 37174 → 22 [ACK] Seq=37 Ack=7121 Win=501 Len=0 TSval=3681649297 TSecr=28516069
  170 1.080908538 10.255.150.111 → 10.205.7.1   SSH 198 Server: Encrypted packet (len=132)
  171 1.081210453 10.255.150.111 → 10.205.7.1   SSH 198 Server: Encrypted packet (len=132)
  172 1.081267404   10.205.7.1 → 10.255.150.111 TCP 66 37174 → 22 [ACK] Seq=37 Ack=7253 Win=501 Len=0 TSval=3681649297 TSecr=28516069
  173 1.081500036   10.205.7.1 → 10.255.150.111 TCP 66 37174 → 22 [ACK] Seq=37 Ack=7385 Win=501 Len=0 TSval=3681649297 TSecr=28516070
  174 1.081848947 10.255.150.111 → 10.205.7.1   SSH 382 Server: Encrypted packet (len=316)
  175 1.082154693   10.205.7.1 → 10.255.150.111 TCP 66 37174 → 22 [ACK] Seq=37 Ack=7701 Win=501 Len=0 TSval=3681649298 TSecr=28516070
  176 1.082311446 10.255.150.111 → 10.205.7.1   SSH 294 Server: Encrypted packet (len=228)
  177 1.082439051 10.255.150.111 → 10.205.7.1   SSH 102 Server: Encrypted packet (len=36)
  178 1.082615465   10.205.7.1 → 10.255.150.111 TCP 66 37174 → 22 [ACK] Seq=37 Ack=7929 Win=501 Len=0 TSval=3681649298 TSecr=28516070
  179 1.082696293   10.205.7.1 → 10.255.150.111 TCP 66 37174 → 22 [ACK] Seq=37 Ack=7965 Win=501 Len=0 TSval=3681649298 TSecr=28516070
  180 1.082871992 10.255.150.111 → 10.205.7.1   SSH 238 Server: Encrypted packet (len=172)
  181 1.083028301 10.255.150.111 → 10.205.7.1   SSH 102 Server: Encrypted packet (len=36)
  182 1.083182869   10.205.7.1 → 10.255.150.111 TCP 66 37174 → 22 [ACK] Seq=37 Ack=8137 Win=501 Len=0 TSval=3681649299 TSecr=28516070
  183 1.083353418   10.205.7.1 → 10.255.150.111 TCP 66 37174 → 22 [ACK] Seq=37 Ack=8173 Win=501 Len=0 TSval=3681649299 TSecr=28516070
  184 1.083399546 10.255.150.111 → 10.205.7.1   SSH 238 Server: Encrypted packet (len=172)
  185 1.083757194   10.205.7.1 → 10.255.150.111 TCP 66 37174 → 22 [ACK] Seq=37 Ack=8345 Win=501 Len=0 TSval=3681649299 TSecr=28516070
  186 1.083795920 10.255.150.111 → 10.205.7.1   SSH 102 Server: Encrypted packet (len=36)
  187 1.084098417   10.205.7.1 → 10.255.150.111 TCP 66 37174 → 22 [ACK] Seq=37 Ack=8381 Win=501 Len=0 TSval=3681649300 TSecr=28516070
  188 1.084210053 10.255.150.111 → 10.205.7.1   SSH 286 Server: Encrypted packet (len=220)
  189 1.084455087   10.205.7.1 → 10.255.150.111 TCP 66 37174 → 22 [ACK] Seq=37 Ack=8601 Win=501 Len=0 TSval=3681649300 TSecr=28516070
  190 1.084516561 10.255.150.111 → 10.205.7.1   SSH 238 Server: Encrypted packet (len=172)
  191 1.084780566   10.205.7.1 → 10.255.150.111 TCP 66 37174 → 22 [ACK] Seq=37 Ack=8773 Win=501 Len=0 TSval=3681649301 TSecr=28516070
  192 1.085097559 10.255.150.111 → 10.205.7.1   SSH 294 Server: Encrypted packet (len=228)
  193 1.085366824   10.205.7.1 → 10.255.150.111 TCP 66 37174 → 22 [ACK] Seq=37 Ack=9001 Win=501 Len=0 TSval=3681649301 TSecr=28516071
  194 1.085452963 10.255.150.111 → 10.205.7.1   SSH 238 Server: Encrypted packet (len=172)
  195 1.085829457   10.205.7.1 → 10.255.150.111 TCP 66 37174 → 22 [ACK] Seq=37 Ack=9173 Win=501 Len=0 TSval=3681649301 TSecr=28516071
  196 1.085944032 10.255.150.111 → 10.205.7.1   SSH 334 Server: Encrypted packet (len=268)
  197 1.086112649 10.255.150.111 → 10.205.7.1   SSH 102 Server: Encrypted packet (len=36)
  198 1.086278698   10.205.7.1 → 10.255.150.111 TCP 66 37174 → 22 [ACK] Seq=37 Ack=9441 Win=501 Len=0 TSval=3681649302 TSecr=28516071
  199 1.086373657   10.205.7.1 → 10.255.150.111 TCP 66 37174 → 22 [ACK] Seq=37 Ack=9477 Win=501 Len=0 TSval=3681649302 TSecr=28516071
  200 1.086509853 10.255.150.111 → 10.205.7.1   SSH 198 Server: Encrypted packet (len=132)
  201 1.086762234   10.205.7.1 → 10.255.150.111 TCP 66 37174 → 22 [ACK] Seq=37 Ack=9609 Win=501 Len=0 TSval=3681649302 TSecr=28516071
  202 1.086851313 10.255.150.111 → 10.205.7.1   SSH 238 Server: Encrypted packet (len=172)
  203 1.087141881   10.205.7.1 → 10.255.150.111 TCP 66 37174 → 22 [ACK] Seq=37 Ack=9781 Win=501 Len=0 TSval=3681649303 TSecr=28516071
  204 1.087372837 10.255.150.111 → 10.205.7.1   SSH 246 Server: Encrypted packet (len=180)
  205 1.087549018 10.255.150.111 → 10.205.7.1   SSH 198 Server: Encrypted packet (len=132)
  206 1.087703838   10.205.7.1 → 10.255.150.111 TCP 66 37174 → 22 [ACK] Seq=37 Ack=9961 Win=501 Len=0 TSval=3681649303 TSecr=28516071
  207 1.087859204   10.205.7.1 → 10.255.150.111 TCP 66 37174 → 22 [ACK] Seq=37 Ack=10093 Win=501 Len=0 TSval=3681649304 TSecr=28516071
  208 1.087981136 10.255.150.111 → 10.205.7.1   SSH 198 Server: Encrypted packet (len=132)
  209 1.088257261   10.205.7.1 → 10.255.150.111 TCP 66 37174 → 22 [ACK] Seq=37 Ack=10225 Win=501 Len=0 TSval=3681649304 TSecr=28516071
  210 1.088326013 10.255.150.111 → 10.205.7.1   SSH 238 Server: Encrypted packet (len=172)
  211 1.088715981 10.255.150.111 → 10.205.7.1   SSH 334 Server: Encrypted packet (len=268)
  212 1.088742078   10.205.7.1 → 10.255.150.111 TCP 66 37174 → 22 [ACK] Seq=37 Ack=10397 Win=501 Len=0 TSval=3681649304 TSecr=28516071
  213 1.088982730   10.205.7.1 → 10.255.150.111 TCP 66 37174 → 22 [ACK] Seq=37 Ack=10665 Win=501 Len=0 TSval=3681649305 TSecr=28516071
  214 1.089151346 10.255.150.111 → 10.205.7.1   SSH 198 Server: Encrypted packet (len=132)
  215 1.089460209   10.205.7.1 → 10.255.150.111 TCP 66 37174 → 22 [ACK] Seq=37 Ack=10797 Win=501 Len=0 TSval=3681649305 TSecr=28516072
  216 1.089496370 10.255.150.111 → 10.205.7.1   SSH 238 Server: Encrypted packet (len=172)
  217 1.089747642   10.205.7.1 → 10.255.150.111 TCP 66 37174 → 22 [ACK] Seq=37 Ack=10969 Win=501 Len=0 TSval=3681649305 TSecr=28516072
  218 1.089846183 10.255.150.111 → 10.205.7.1   SSH 238 Server: Encrypted packet (len=172)
  219 1.090059304   10.205.7.1 → 10.255.150.111 TCP 66 37174 → 22 [ACK] Seq=37 Ack=11141 Win=501 Len=0 TSval=3681649306 TSecr=28516072
  220 1.090249414 10.255.150.111 → 10.205.7.1   SSH 198 Server: Encrypted packet (len=132)
  221 1.090421775 10.255.150.111 → 10.205.7.1   SSH 102 Server: Encrypted packet (len=36)
  222 1.090599922   10.205.7.1 → 10.255.150.111 TCP 66 37174 → 22 [ACK] Seq=37 Ack=11273 Win=501 Len=0 TSval=3681649306 TSecr=28516072
  223 1.090633197   10.205.7.1 → 10.255.150.111 TCP 66 37174 → 22 [ACK] Seq=37 Ack=11309 Win=501 Len=0 TSval=3681649306 TSecr=28516072
  224 1.090776265 10.255.150.111 → 10.205.7.1   SSH 198 Server: Encrypted packet (len=132)
  225 1.091061424 10.255.150.111 → 10.205.7.1   SSH 102 Server: Encrypted packet (len=36)
  226 1.091101999   10.205.7.1 → 10.255.150.111 TCP 66 37174 → 22 [ACK] Seq=37 Ack=11441 Win=501 Len=0 TSval=3681649307 TSecr=28516072
  227 1.091309703   10.205.7.1 → 10.255.150.111 TCP 66 37174 → 22 [ACK] Seq=37 Ack=11477 Win=501 Len=0 TSval=3681649307 TSecr=28516072
  228 1.091528323 10.255.150.111 → 10.205.7.1   SSH 334 Server: Encrypted packet (len=268)
  229 1.091802532 10.255.150.111 → 10.205.7.1   SSH 198 Server: Encrypted packet (len=132)
  230 1.091927686   10.205.7.1 → 10.255.150.111 TCP 66 37174 → 22 [ACK] Seq=37 Ack=11745 Win=501 Len=0 TSval=3681649308 TSecr=28516072
  231 1.092133277   10.205.7.1 → 10.255.150.111 TCP 66 37174 → 22 [ACK] Seq=37 Ack=11877 Win=501 Len=0 TSval=3681649308 TSecr=28516072
  232 1.092153724 10.255.150.111 → 10.205.7.1   SSH 238 Server: Encrypted packet (len=172)
  233 1.092384101   10.205.7.1 → 10.255.150.111 TCP 66 37174 → 22 [ACK] Seq=37 Ack=12049 Win=501 Len=0 TSval=3681649308 TSecr=28516072
  234 1.092525207 10.255.150.111 → 10.205.7.1   SSH 238 Server: Encrypted packet (len=172)
  235 1.092845855   10.205.7.1 → 10.255.150.111 TCP 66 37174 → 22 [ACK] Seq=37 Ack=12221 Win=501 Len=0 TSval=3681649309 TSecr=28516072
  236 1.092913381 10.255.150.111 → 10.205.7.1   SSH 198 Server: Encrypted packet (len=132)
  237 1.093186999   10.205.7.1 → 10.255.150.111 TCP 66 37174 → 22 [ACK] Seq=37 Ack=12353 Win=501 Len=0 TSval=3681649309 TSecr=28516072
  238 1.093274006 10.255.150.111 → 10.205.7.1   SSH 198 Server: Encrypted packet (len=132)
  239 1.093520634   10.205.7.1 → 10.255.150.111 TCP 66 37174 → 22 [ACK] Seq=37 Ack=12485 Win=501 Len=0 TSval=3681649309 TSecr=28516073
  240 1.093866774 10.255.150.111 → 10.205.7.1   SSH 382 Server: Encrypted packet (len=316)
  241 1.093994843 10.255.150.111 → 10.205.7.1   SSH 102 Server: Encrypted packet (len=36)
  242 1.094253347   10.205.7.1 → 10.255.150.111 TCP 66 37174 → 22 [ACK] Seq=37 Ack=12837 Win=501 Len=0 TSval=3681649310 TSecr=28516073
  243 1.094290107 10.255.150.111 → 10.205.7.1   SSH 198 Server: Encrypted packet (len=132)
  244 1.094519352   10.205.7.1 → 10.255.150.111 TCP 66 37174 → 22 [ACK] Seq=37 Ack=12969 Win=501 Len=0 TSval=3681649310 TSecr=28516073
  245 1.094674702 10.255.150.111 → 10.205.7.1   SSH 198 Server: Encrypted packet (len=132)
  246 1.094951936 10.255.150.111 → 10.205.7.1   SSH 238 Server: Encrypted packet (len=172)
  247 1.095011271   10.205.7.1 → 10.255.150.111 TCP 66 37174 → 22 [ACK] Seq=37 Ack=13101 Win=501 Len=0 TSval=3681649311 TSecr=28516073
  248 1.095202039   10.205.7.1 → 10.255.150.111 TCP 66 37174 → 22 [ACK] Seq=37 Ack=13273 Win=501 Len=0 TSval=3681649311 TSecr=28516073
  249 1.095360708 10.255.150.111 → 10.205.7.1   SSH 198 Server: Encrypted packet (len=132)
  250 1.095536540 10.255.150.111 → 10.205.7.1   SSH 102 Server: Encrypted packet (len=36)
  251 1.095598281   10.205.7.1 → 10.255.150.111 TCP 66 37174 → 22 [ACK] Seq=37 Ack=13405 Win=501 Len=0 TSval=3681649311 TSecr=28516073
  252 1.095831845   10.205.7.1 → 10.255.150.111 TCP 66 37174 → 22 [ACK] Seq=37 Ack=13441 Win=501 Len=0 TSval=3681649312 TSecr=28516073
  253 1.096046842 10.255.150.111 → 10.205.7.1   SSH 382 Server: Encrypted packet (len=316)
  254 1.096204662 10.255.150.111 → 10.205.7.1   SSH 102 Server: Encrypted packet (len=36)
  255 1.096391223   10.205.7.1 → 10.255.150.111 TCP 66 37174 → 22 [ACK] Seq=37 Ack=13757 Win=501 Len=0 TSval=3681649312 TSecr=28516073
  256 1.096510144   10.205.7.1 → 10.255.150.111 TCP 66 37174 → 22 [ACK] Seq=37 Ack=13793 Win=501 Len=0 TSval=3681649312 TSecr=28516073
  257 1.581490499 10.255.150.111 → 10.205.7.1   SSH 198 Server: Encrypted packet (len=132)
  258 1.581845331 10.255.150.111 → 10.205.7.1   SSH 198 Server: Encrypted packet (len=132)
  259 1.582008028   10.205.7.1 → 10.255.150.111 TCP 66 37174 → 22 [ACK] Seq=37 Ack=13925 Win=501 Len=0 TSval=3681649798 TSecr=28516195
  260 1.582187889 10.255.150.111 → 10.205.7.1   SSH 246 Server: Encrypted packet (len=180)
  261 1.582235588   10.205.7.1 → 10.255.150.111 TCP 66 37174 → 22 [ACK] Seq=37 Ack=14057 Win=501 Len=0 TSval=3681649798 TSecr=28516195
  262 1.582492412 10.255.150.111 → 10.205.7.1   SSH 246 Server: Encrypted packet (len=180)
  263 1.582591743   10.205.7.1 → 10.255.150.111 TCP 66 37174 → 22 [ACK] Seq=37 Ack=14237 Win=501 Len=0 TSval=3681649798 TSecr=28516195
  264 1.582771327   10.205.7.1 → 10.255.150.111 TCP 66 37174 → 22 [ACK] Seq=37 Ack=14417 Win=501 Len=0 TSval=3681649798 TSecr=28516195
  265 1.582915752 10.255.150.111 → 10.205.7.1   SSH 198 Server: Encrypted packet (len=132)
  266 1.583046975 10.255.150.111 → 10.205.7.1   SSH 102 Server: Encrypted packet (len=36)
  267 1.583233892   10.205.7.1 → 10.255.150.111 TCP 66 37174 → 22 [ACK] Seq=37 Ack=14549 Win=501 Len=0 TSval=3681649799 TSecr=28516195
  268 1.583342731 10.255.150.111 → 10.205.7.1   SSH 198 Server: Encrypted packet (len=132)
  269 1.583393193   10.205.7.1 → 10.255.150.111 TCP 66 37174 → 22 [ACK] Seq=37 Ack=14585 Win=501 Len=0 TSval=3681649799 TSecr=28516195
  270 1.583632984   10.205.7.1 → 10.255.150.111 TCP 66 37174 → 22 [ACK] Seq=37 Ack=14717 Win=501 Len=0 TSval=3681649799 TSecr=28516195
  271 1.583700581 10.255.150.111 → 10.205.7.1   SSH 246 Server: Encrypted packet (len=180)
  272 1.584016226   10.205.7.1 → 10.255.150.111 TCP 66 37174 → 22 [ACK] Seq=37 Ack=14897 Win=501 Len=0 TSval=3681649800 TSecr=28516195
  273 1.584111139 10.255.150.111 → 10.205.7.1   SSH 334 Server: Encrypted packet (len=268)
  274 1.584430979   10.205.7.1 → 10.255.150.111 TCP 66 37174 → 22 [ACK] Seq=37 Ack=15165 Win=501 Len=0 TSval=3681649800 TSecr=28516195
  275 1.584446321 10.255.150.111 → 10.205.7.1   SSH 198 Server: Encrypted packet (len=132)
  276 1.584853927   10.205.7.1 → 10.255.150.111 TCP 66 37174 → 22 [ACK] Seq=37 Ack=15297 Win=501 Len=0 TSval=3681649801 TSecr=28516195
  277 1.584924510 10.255.150.111 → 10.205.7.1   SSH 382 Server: Encrypted packet (len=316)
  278 1.585249361   10.205.7.1 → 10.255.150.111 TCP 66 37174 → 22 [ACK] Seq=37 Ack=15613 Win=501 Len=0 TSval=3681649801 TSecr=28516195
  279 1.585445697 10.255.150.111 → 10.205.7.1   SSH 198 Server: Encrypted packet (len=132)
  280 1.585747664 10.255.150.111 → 10.205.7.1   SSH 198 Server: Encrypted packet (len=132)
  281 1.585849716   10.205.7.1 → 10.255.150.111 TCP 66 37174 → 22 [ACK] Seq=37 Ack=15745 Win=501 Len=0 TSval=3681649801 TSecr=28516196
  282 1.586021863   10.205.7.1 → 10.255.150.111 TCP 66 37174 → 22 [ACK] Seq=37 Ack=15877 Win=501 Len=0 TSval=3681649802 TSecr=28516196
  283 1.586110521 10.255.150.111 → 10.205.7.1   SSH 246 Server: Encrypted packet (len=180)
  284 1.586366910 10.255.150.111 → 10.205.7.1   SSH 246 Server: Encrypted packet (len=180)
  285 1.586453455   10.205.7.1 → 10.255.150.111 TCP 66 37174 → 22 [ACK] Seq=37 Ack=16057 Win=501 Len=0 TSval=3681649802 TSecr=28516196
  286 1.586646117   10.205.7.1 → 10.255.150.111 TCP 66 37174 → 22 [ACK] Seq=37 Ack=16237 Win=501 Len=0 TSval=3681649802 TSecr=28516196
  287 1.586728475 10.255.150.111 → 10.205.7.1   SSH 198 Server: Encrypted packet (len=132)
  288 1.587050209   10.205.7.1 → 10.255.150.111 TCP 66 37174 → 22 [ACK] Seq=37 Ack=16369 Win=501 Len=0 TSval=3681649803 TSecr=28516196
  289 1.587214799 10.255.150.111 → 10.205.7.1   SSH 334 Server: Encrypted packet (len=268)
  290 1.587347530 10.255.150.111 → 10.205.7.1   SSH 102 Server: Encrypted packet (len=36)
  291 1.587584150 10.255.150.111 → 10.205.7.1   SSH 238 Server: Encrypted packet (len=172)
  292 1.587670203   10.205.7.1 → 10.255.150.111 TCP 66 37174 → 22 [ACK] Seq=37 Ack=16673 Win=501 Len=0 TSval=3681649803 TSecr=28516196
  293 1.587857027   10.205.7.1 → 10.255.150.111 TCP 66 37174 → 22 [ACK] Seq=37 Ack=16845 Win=501 Len=0 TSval=3681649804 TSecr=28516196
  294 1.588098557 10.255.150.111 → 10.205.7.1   SSH 198 Server: Encrypted packet (len=132)
  295 1.588364089 10.255.150.111 → 10.205.7.1   SSH 198 Server: Encrypted packet (len=132)
  296 1.588454277   10.205.7.1 → 10.255.150.111 TCP 66 37174 → 22 [ACK] Seq=37 Ack=16977 Win=501 Len=0 TSval=3681649804 TSecr=28516196
  297 1.588622270   10.205.7.1 → 10.255.150.111 TCP 66 37174 → 22 [ACK] Seq=37 Ack=17109 Win=501 Len=0 TSval=3681649804 TSecr=28516196
  298 1.588789191 10.255.150.111 → 10.205.7.1   SSH 246 Server: Encrypted packet (len=180)
  299 1.589084324 10.255.150.111 → 10.205.7.1   SSH 246 Server: Encrypted packet (len=180)
  300 1.589185858   10.205.7.1 → 10.255.150.111 TCP 66 37174 → 22 [ACK] Seq=37 Ack=17289 Win=501 Len=0 TSval=3681649805 TSecr=28516196
  301 1.589394156   10.205.7.1 → 10.255.150.111 TCP 66 37174 → 22 [ACK] Seq=37 Ack=17469 Win=501 Len=0 TSval=3681649805 TSecr=28516197
  302 1.589501491 10.255.150.111 → 10.205.7.1   SSH 198 Server: Encrypted packet (len=132)
  303 1.589805740   10.205.7.1 → 10.255.150.111 TCP 66 37174 → 22 [ACK] Seq=37 Ack=17601 Win=501 Len=0 TSval=3681649805 TSecr=28516197
  304 1.589858056 10.255.150.111 → 10.205.7.1   SSH 198 Server: Encrypted packet (len=132)
  305 1.590115862 10.255.150.111 → 10.205.7.1   SSH 246 Server: Encrypted packet (len=180)
  306 1.590148474   10.205.7.1 → 10.255.150.111 TCP 66 37174 → 22 [ACK] Seq=37 Ack=17733 Win=501 Len=0 TSval=3681649806 TSecr=28516197
  307 1.590448193   10.205.7.1 → 10.255.150.111 TCP 66 37174 → 22 [ACK] Seq=37 Ack=17913 Win=501 Len=0 TSval=3681649806 TSecr=28516197
  308 1.590558246 10.255.150.111 → 10.205.7.1   SSH 334 Server: Encrypted packet (len=268)
  309 1.590821152   10.205.7.1 → 10.255.150.111 TCP 66 37174 → 22 [ACK] Seq=37 Ack=18181 Win=501 Len=0 TSval=3681649807 TSecr=28516197
  310 1.590872988 10.255.150.111 → 10.205.7.1   SSH 198 Server: Encrypted packet (len=132)
  311 1.591216962   10.205.7.1 → 10.255.150.111 TCP 66 37174 → 22 [ACK] Seq=37 Ack=18313 Win=501 Len=0 TSval=3681649807 TSecr=28516197
  312 1.591393557 10.255.150.111 → 10.205.7.1   SSH 382 Server: Encrypted packet (len=316)
  313 1.591527505 10.255.150.111 → 10.205.7.1   SSH 102 Server: Encrypted packet (len=36)
  314 1.591775945   10.205.7.1 → 10.255.150.111 TCP 66 37174 → 22 [ACK] Seq=37 Ack=18629 Win=501 Len=0 TSval=3681649807 TSecr=28516197
  315 1.591825333 10.255.150.111 → 10.205.7.1   SSH 198 Server: Encrypted packet (len=132)
  316 1.591868784   10.205.7.1 → 10.255.150.111 TCP 66 37174 → 22 [ACK] Seq=37 Ack=18665 Win=501 Len=0 TSval=3681649808 TSecr=28516197
  317 1.592144206   10.205.7.1 → 10.255.150.111 TCP 66 37174 → 22 [ACK] Seq=37 Ack=18797 Win=501 Len=0 TSval=3681649808 TSecr=28516197
  318 1.592286428 10.255.150.111 → 10.205.7.1   SSH 334 Server: Encrypted packet (len=268)
  319 1.592541978 10.255.150.111 → 10.205.7.1   SSH 246 Server: Encrypted packet (len=180)
  320 1.592633008   10.205.7.1 → 10.255.150.111 TCP 66 37174 → 22 [ACK] Seq=37 Ack=19065 Win=501 Len=0 TSval=3681649808 TSecr=28516197
  321 1.592855829   10.205.7.1 → 10.255.150.111 TCP 66 37174 → 22 [ACK] Seq=37 Ack=19245 Win=501 Len=0 TSval=3681649808 TSecr=28516197
  322 1.592911415 10.255.150.111 → 10.205.7.1   SSH 198 Server: Encrypted packet (len=132)
  323 1.593185792   10.205.7.1 → 10.255.150.111 TCP 66 37174 → 22 [ACK] Seq=37 Ack=19377 Win=501 Len=0 TSval=3681649809 TSecr=28516197
  324 1.593294127 10.255.150.111 → 10.205.7.1   SSH 198 Server: Encrypted packet (len=132)
  325 1.593581884   10.205.7.1 → 10.255.150.111 TCP 66 37174 → 22 [ACK] Seq=37 Ack=19509 Win=501 Len=0 TSval=3681649809 TSecr=28516198
  326 1.593649873 10.255.150.111 → 10.205.7.1   SSH 246 Server: Encrypted packet (len=180)
  327 1.593936580 10.255.150.111 → 10.205.7.1   SSH 246 Server: Encrypted packet (len=180)
  328 1.594062122   10.205.7.1 → 10.255.150.111 TCP 66 37174 → 22 [ACK] Seq=37 Ack=19689 Win=501 Len=0 TSval=3681649810 TSecr=28516198
  329 1.594278919   10.205.7.1 → 10.255.150.111 TCP 66 37174 → 22 [ACK] Seq=37 Ack=19869 Win=501 Len=0 TSval=3681649810 TSecr=28516198
  330 1.594308137 10.255.150.111 → 10.205.7.1   SSH 198 Server: Encrypted packet (len=132)
  331 1.594582353 10.255.150.111 → 10.205.7.1   SSH 198 Server: Encrypted packet (len=132)
  332 1.594678018   10.205.7.1 → 10.255.150.111 TCP 66 37174 → 22 [ACK] Seq=37 Ack=20001 Win=501 Len=0 TSval=3681649810 TSecr=28516198
  333 1.594881704   10.205.7.1 → 10.255.150.111 TCP 66 37174 → 22 [ACK] Seq=37 Ack=20133 Win=501 Len=0 TSval=3681649811 TSecr=28516198
  334 1.594929884 10.255.150.111 → 10.205.7.1   SSH 238 Server: Encrypted packet (len=172)
  335 1.595155174   10.205.7.1 → 10.255.150.111 TCP 66 37174 → 22 [ACK] Seq=37 Ack=20305 Win=501 Len=0 TSval=3681649811 TSecr=28516198
  336 1.595363066 10.255.150.111 → 10.205.7.1   SSH 334 Server: Encrypted packet (len=268)
  337 1.595643841   10.205.7.1 → 10.255.150.111 TCP 66 37174 → 22 [ACK] Seq=37 Ack=20573 Win=501 Len=0 TSval=3681649811 TSecr=28516198
  338 1.595726018 10.255.150.111 → 10.205.7.1   SSH 198 Server: Encrypted packet (len=132)
  339 1.595983538 10.255.150.111 → 10.205.7.1   SSH 246 Server: Encrypted packet (len=180)
  340 1.596083575   10.205.7.1 → 10.255.150.111 TCP 66 37174 → 22 [ACK] Seq=37 Ack=20705 Win=501 Len=0 TSval=3681649812 TSecr=28516198
  341 1.596282820   10.205.7.1 → 10.255.150.111 TCP 66 37174 → 22 [ACK] Seq=37 Ack=20885 Win=501 Len=0 TSval=3681649812 TSecr=28516198
  342 1.596342234 10.255.150.111 → 10.205.7.1   SSH 246 Server: Encrypted packet (len=180)
  343 1.596609208 10.255.150.111 → 10.205.7.1   SSH 198 Server: Encrypted packet (len=132)
  344 1.596660374   10.205.7.1 → 10.255.150.111 TCP 66 37174 → 22 [ACK] Seq=37 Ack=21065 Win=501 Len=0 TSval=3681649812 TSecr=28516198
  345 1.596889830   10.205.7.1 → 10.255.150.111 TCP 66 37174 → 22 [ACK] Seq=37 Ack=21197 Win=501 Len=0 TSval=3681649813 TSecr=28516198
  346 1.596977661 10.255.150.111 → 10.205.7.1   SSH 198 Server: Encrypted packet (len=132)
  347 1.597224478   10.205.7.1 → 10.255.150.111 TCP 66 37174 → 22 [ACK] Seq=37 Ack=21329 Win=501 Len=0 TSval=3681649813 TSecr=28516198
  348 1.597425820 10.255.150.111 → 10.205.7.1   SSH 382 Server: Encrypted packet (len=316)
  349 1.597696859   10.205.7.1 → 10.255.150.111 TCP 66 37174 → 22 [ACK] Seq=37 Ack=21645 Win=501 Len=0 TSval=3681649813 TSecr=28516199
  350 1.597806084 10.255.150.111 → 10.205.7.1   SSH 198 Server: Encrypted packet (len=132)
  351 1.598053130   10.205.7.1 → 10.255.150.111 TCP 66 37174 → 22 [ACK] Seq=37 Ack=21777 Win=501 Len=0 TSval=3681649814 TSecr=28516199
  352 1.598258240 10.255.150.111 → 10.205.7.1   SSH 198 Server: Encrypted packet (len=132)
  353 1.598392771 10.255.150.111 → 10.205.7.1   SSH 102 Server: Encrypted packet (len=36)
  354 1.598527557   10.205.7.1 → 10.255.150.111 TCP 66 37174 → 22 [ACK] Seq=37 Ack=21909 Win=501 Len=0 TSval=3681649814 TSecr=28516199
  355 1.598678400   10.205.7.1 → 10.255.150.111 TCP 66 37174 → 22 [ACK] Seq=37 Ack=21945 Win=501 Len=0 TSval=3681649814 TSecr=28516199
  356 1.598756035 10.255.150.111 → 10.205.7.1   SSH 238 Server: Encrypted packet (len=172)
  357 1.599013223 10.255.150.111 → 10.205.7.1   SSH 246 Server: Encrypted packet (len=180)
  358 1.599138014   10.205.7.1 → 10.255.150.111 TCP 66 37174 → 22 [ACK] Seq=37 Ack=22117 Win=501 Len=0 TSval=3681649815 TSecr=28516199
  359 1.599336668   10.205.7.1 → 10.255.150.111 TCP 66 37174 → 22 [ACK] Seq=37 Ack=22297 Win=501 Len=0 TSval=3681649815 TSecr=28516199
